"AwardNumber","Title","NSFOrganization","Program(s)","StartDate","LastAmendmentDate","PrincipalInvestigator","State","Organization","AwardInstrument","ProgramManager","EndDate","AwardedAmountToDate","Co-PIName(s)","PIEmailAddress","OrganizationStreet","OrganizationCity","OrganizationState","OrganizationZip","OrganizationPhone","NSFDirectorate","ProgramElementCode(s)","ProgramReferenceCode(s)","ARRAAmount","Abstract"
"1400575","Technicians in Energy, Advanced Manufacturing, and Supply Chain Technology (TEAMS) Project","DUE","S-STEM-Schlr Sci Tech Eng&Math, Advanced Tech Education Prog","09/15/2014","01/23/2015","Ronald Logreco","PA","Community College of Allegheny County Allegheny Campus","Standard Grant","Heather Watson","08/31/2018","$642,103.00","Gretchen Mullin-Sawicki","rlogreco@ccac.edu","800 Allegheny Avenue","Pittsburgh","PA","152331895","4122372227","EHR","1536, 7412","1032, 9178, SMET","$0.00","The Technicians in Energy, Advanced Manufacturing, and Supply Chain Technology (TEAMS) Project at the Community College of Allegheny County in Oakdale, Pennsylvania aims to bridge the gap between employers and workers in the energy, advanced manufacturing, and supply chain technology fields in Western Pennsylvania. Through this project faculty will collaborate with industry to create industry-relevant mechatronics specializations, and develop applied capstone projects focusing on the design, operation, installation, troubleshooting and maintenance skills essential to energy and manufacturing, and supply chain processes. Oil and gas operations in the Marcellus Shale of Western Pennsylvania have resulted in increased workforce demand not only for jobs directly in the energy industry, but also jobs in ancillary and logistics industries such as advanced manufacturing and supply chain technology. Mechatronics educated-technicians are needed for many of these jobs: from the midstream Marcellus Shale gas being produced and processed through the pipeline, to the energy-efficient operations and maintenance of equipment in the cracker plant, to the supply chain technologies used to distribute the petrochemicals, to the manufacturing plants that receive and utilize the chemicals. This ATE TEAMS Project will help to close the gap between employers and workers in these industries by building mechatronics career pathways through the community college and into the workforce. This project ensures that workers have the right combination of academic and industry-endorsed skill-sets to meet regional, state and national demands. <br/><br/>The TEAMS Project utilizes a student-centered approach to develop the occupational skills needed to prepare a growing influx of nontraditional adult students to succeed in the workplace. Career strategies and foundational core courses within the Associate of Science (A.S.) degree at the Community College of Allegheny County in mechatronics integrate national certifications. This creates a focus at the college on the skills needed to link higher education with workforce needs. Faculty development with equal emphasis on technology and pedagogy balances workforce and academic education and assessment. Through the TEAMS Project, the Community College of Allegheny County is establishing a transportable curriculum model which can increase access to higher education by rural, veteran, and other non-traditional populations.  The project provides access to postsecondary STEM education and personalized supportive services to these groups.  In addition, the project is also increasing the number of teachers and students that are nationally certified in mechatronics-related competencies.  The TEAMS project adds to the number of faculty who are able to integrate career readiness with academic rigor in the curriculum. The TEAMS  Mechatronics degree aligns well with the current workplace needs but also includes the flexibility needed to adapt to the evolving requirements of industry. The TEAMS project includes efforts to disseminate the methods and results of this effort to a national audience.<br/><br/>Evaluation of the TEAMS Project will examine whether project objectives are being reached. Summative evaluations will include information regarding the effectiveness of methods to build the capacity of faculty to respond to technical education needs across the industries of energy, advanced manufacturing, and supply chain technology.  The project evaluation will also inform efforts of educators who implement a mechatronics curriculum to support a workforce pipeline that directly responds to regional economic development in the energy, advanced manufacturing, and supply chain industries."
"1458505","Biotechnology, Bioremediation, Math and Science (BioMaS) Workforce Collaborative","DUE","S-STEM-Schlr Sci Tech Eng&Math","10/01/2015","09/21/2015","Caroline Evans","PA","Community College of Allegheny County Allegheny Campus","Standard Grant","Tom Higgins","09/30/2021","$629,207.00","Sandra Bobick, Anne Tanski, Stephanie Goloway","cevans@ccac.edu","800 Allegheny Avenue","Pittsburgh","PA","152331895","4122372227","EHR","1536","9178, SMET","$0.00","This National Science Foundation Scholarships in Science, Technology, Engineering, and Mathematics (S-STEM) project at the Community College of Allegheny County, Allegheny Campus, will provide scholarships, academic support, and wraparound services to talented associate's degree students majoring in Biotechnology, Bioremediation, and Math & Science (BioMaS) who demonstrate financial need. The project will address the need for biotechnology workers, as well as science and mathematics teachers, in the ten-county Pittsburgh region by training scholarship recipients for employment in these high-growth sectors, and providing the support scholars need to excel and become highly-qualified graduates in their fields.<br/><br/>BioMaS project goals will include (1) providing scholarships and critical wraparound services, including an onsite clinical social worker to assist students with barriers, internship opportunities, and the job search; learning community experiences; and tutoring to improve retention, persistence, graduation and employment rates; (2) strengthening pathways to employment; (3) connecting degree programs to regional industry by linking potential employers and college training to solidify and build sustainability through an employment pipeline; and (4) providing information on STEM training and jobs for high-school and college students, including veterans and underrepresented minorities. The BioMaS project will create pathways to biotechnology and bioremediation employment opportunities, or to further education for graduates, by leveraging well-established business and higher education partnerships. In addition, a partnership with Indiana University of Pennsylvania will provide a pathway for BioMaS Math & Sciences graduates to obtain bachelor's degrees in middle-level education in math and science. Project goals will be evaluated via both qualitative and quantitative analyses of data such as scholar demographics, enrollment and completion patterns, background preparation, and course and program performance; scholar participation rates and feedback regarding optional program elements; and rates of employment. The project is ultimately expected to serve as a model for community colleges, particularly in terms of understanding of how to develop wraparound services for students that will support them as they prepare to contribute to a highly-skilled STEM workforce."
"1902236","Advancing Mechatronics Technician Education","DUE","Advanced Tech Education Prog","07/01/2019","06/11/2020","Patricia Thompson","PA","Community College of Allegheny County Allegheny Campus","Standard Grant","John Jackman","06/30/2022","$402,560.00","Adnan Buxamusa, Christopher Quick, Justin Starr, Janine Mickey","pthompson@ccac.edu","800 Allegheny Avenue","Pittsburgh","PA","152331895","4122372227","EHR","7412","1032, 9178, SMET","$0.00","The manufacturing industry in the United States has an increasing need for well-qualified workers. In the western region of Pennsylvania, there are growing needs for skilled technicians in advanced manufacturing and energy companies. To help address this situation, the Community College of Allegheny County will work with industry partners and community organizations to develop courses in new technology areas and expand the college's associate degree program in mechatronics (a blend of mechanical, electrical, and computerized technologies). These new courses will address areas such as robotics, plastics technology, and process technology. Faculty will also be able to obtain certifications in these new areas. This expansion of the program into areas of industrial growth will serve as a model for the benefits of integrating industry certification with academic coursework. The mechatronics program will be designed to offer a variety of options that allow more students to participate and obtain degrees. The project team will also work with secondary school teachers to increase the interest of high school students in career pathways in advanced manufacturing fields. The project will help increase the number of technicians with skills needed for the workforce in the western Pennsylvania region and the nation. <br/><br/>Three goals will guide the project. First, to expand the existing mechatronics degree program to include specialization courses in Robotics, Plastics and Process Technology, and Green Manufacturing. Second, to provide professional development and certifications for faculty in these new technology areas. Three, to develop strategies to increase the exposure and retention along career pathways for secondary school and community college students. The new courses will cover concepts and skills based on industry-relevant topics such as programming portable and customizable robots, injection molding, plastic material selection, instrumentation and operations, quality control, and equipment troubleshooting. These courses will have an overarching theme of green manufacturing. The new curriculum will incorporate capstone projects that include project-based learning activities and student internships. The mechatronics program will also be enhanced to provide flexible evening and weekend scheduling as well as self-paced, online courses to facilitate more participation from a diverse population of students and students in rural areas. Mechatronics faculty at the college will use transportable trainers to provide hands-on guest lectures for secondary school students to showcase career pathways or instruct course modules at high schools. The college will also host Mechatronics Problem Solving Competitions for secondary school students to encourage their engagement in, and awareness of, technician pathways for advanced manufacturing fields. The curriculum materials and project results will be shared regionally and nationally. This project is funded by the Advanced Technological Education program that focuses on the education of technicians for the advanced-technology fields that drive the nation's economy.<br/><br/>This award reflects NSF's statutory mission and has been deemed worthy of support through evaluation using the Foundation's intellectual merit and broader impacts review criteria."
"0849169","Biotechnology Workforce Collaborative","DUE","S-STEM-Schlr Sci Tech Eng&Math","05/01/2009","12/20/2012","Sandra Bobick","PA","Community College of Allegheny County Allegheny Campus","Continuing grant","karen crosby","04/30/2015","$597,920.00","Anne Tanski, John Law, Allysen Todd, Michelle Zuckerman, Christine Compliment","sbobick@ccac.edu","800 Allegheny Avenue","Pittsburgh","PA","152331895","4122372227","EHR","1536","9178, SMET","$0.00","The biotechnology and life sciences industry has become one of the primary economic forces in Pittsburgh, projecting 20% growth in the need for qualified technicians in the next ten years. If the frontiers of knowledge in Pittsburgh's biotechnology research and development community are to be advanced and scientific breakthroughs are to occur, trained biotechnicians must be available to meet the demand. The aim of the Biotechnology Workforce Collaborative (BWC) is to widen the spectrum of available, skilled workers in the region by enhancing ongoing partnerships with local stakeholders to a burgeoning program for the training of biotechnology/life sciences laboratory technicians. <br/><br/>The objectives and methods include: <br/>(a) Academic training at the college resulting in the associate degree.<br/>(b) A laboratory internship in the laboratories of Allegheny General Hospital,  Allegheny Singer Research Institute (ASRI), the Pittsburgh Tissue Engineering Initiative (PTEI); and the University of Pittsburgh Medical Center McGowan Institute for Regenerative Medicine.<br/>(c) Career development support for individual students starting at the early stages of participant preparation for college work and continuing in assistance for those students upon employment at various research laboratories. <br/>(d) Workgroup meetings to further develop and refine the training approach for laboratory technicians. <br/> <br/>Intellectual Merit: Recruitment efforts focus on developing three staggered cohorts of students. Both academic and employment criteria used in the field are being applied to the selection of promising candidates. Economically and educationally disadvantaged students are being supported by the project that integrates the associate degree for biotechnology technician with the workforce needs of research laboratories that specialize in molecular genetics, tissue engineering and regenerative medicine, and innovation in the application of research results for health care. The collaborative effort includes an internship and long term support for career development of biotechnology/life sciences laboratory technicians. <br/><br/>Broader Impacts: Based on gender, ethnicity, and geography, the cohorts broaden the participation of underrepresented groups in the biotechnology field, predominantly serving the biological sciences. As the BWC continues to become a major player in the Pittsburgh region, this project has an important role in advancing discovery and understanding while promoting teaching, training, and learning between the academic and industry partners. It enhances the infrastructure for research and education as a feeder to meet employment needs and as a critical link to industry. <br/><br/>"
"9411364","PREPnet Internet Expansion Project","OAC","NETWORK INFRASTRUCTURE","07/01/1995","08/03/1995","James Shaulis","PA","Community College of Allegheny County College Office","Standard Grant","Douglas Gatchell","06/30/1997","$25,000.00","Robert Rizzo, Judith Savolskis","","800 Allegheny Ave","Pittsburgh","PA","152331804","4123232323","CSE","4091","9178, SMET","$0.00","9411364   Shaulis  The Community College of Allegheny County requests support from NSF  for connection of its campus network to PREPnet. PREPnet is the  midlevel network located in the state of Pennsylvania. PREPnet will  provide operations management and information services and it will  give the Community College connection to the Internet, a collection  of interoperable networks that connect most research and education  organizations in the United States  The colleges need greater  functionality and network speed to be able to access  supercomputers, libraries, and make file transfers along with being  able to implement a more reliable mail system. The connection will  benefit the faculty research, staff and students. This is also a  unique opportunity for the school to explore innovative educational  resources."
"0093024","Computer and Engineering Technology Scholars Program","DUE","S-STEM-Schlr Sci Tech Eng&Math","07/01/2001","12/13/2001","Pearley Cunningham","PA","Community College of Allegheny County College Office","Standard Grant","Duncan E. McBride","06/30/2003","$182,500.00","Brenda Trettel","pcunningham@ccac.edu","800 Allegheny Ave","Pittsburgh","PA","152331804","4123232323","EHR","1536","1536, 9178, SMET","$0.00","The Computer and Engineering Technology (CET) Scholars Program is designed to provide scholarships to 50 students studying in the areas of Computer Information Technology, Computer-Aided Drafting and Design, Microcomputer Electronics, Electronics Engineering Technology and Robotics and Automated Systems Technology. These majors are all considered advanced technology careers in the state of Pennsylvania. In addition to excellent career opportunities in the region for graduates, these programs offer transferability into baccalaureate programs at local four-year colleges. Working through the Affirmative Action Office of the college, multiple sources are used to contact interested young people, especially women and minorities. High school counselors, scout troops, church youth groups, a web site, and school and group presentations are some of the methods used for recruitment. Factors used by the scholarship selection committee are group diversity, financial need, grade point average (2.8 or higher for selection), letters of recommendation describing career potential, and commitment to career advancement. Working with the Financial Aid Office to build a complete package, the CET Scholars are awarded up to $2,500 per year toward their school expenses. Regardless of major, all CET Scholars complete a common one-year core of Technical Mathematics and Technical Physics designed specifically to enhance the use of these topics by the technology majors, encourage collaborative work, and to stress mastery of conceptual topics. A unique feature of the program is that all CET Scholars complete an external Work Keys Assessment Process. This assessment certifies, to the student, the employer, the school and the funding agencies, the quality of the education and training received. National Work Key Assessment Profiles are available for the careers being targeted by this project."
"7814007","Improvement of the Biological Science Laboratory","SER","ALT IN HIGH ED-INST SC EQ","09/01/1978","09/08/1978","John Dziak","PA","Community College of Allegheny County College Office","Standard Grant","  name not available","08/01/1981","$4,700.00","","","800 Allegheny Ave","Pittsburgh","PA","152331804","4123232323","CSE","7450","","$0.00",""
"7900041","Graphic Slides For Programmed Instruction in Engineering    Mechanics","SER","","04/01/1979","04/10/1979","Harold Levitt","PA","Community College of Allegheny County South Campus","Standard Grant","  name not available","09/30/1980","$10,520.00","","","1750 Clairton Road","West Mifflin","PA","151223029","4122372227","CSE","7850","","$0.00",""
